<?xml version="1.0" encoding="UTF-8"?>
<HL7Validation xmlns:xsi="http://www.w3.org/2001/XMLSchema-instance"
 xsi:noNamespaceSchemaLocation="file:/Users/ralph/work/agilex/SCHIEPPH/Source/schiepph-code/Product/Production/xml/HL7Validation.xsd">
    <ValidVersions>
        <version/>
        <version/>
    </ValidVersions>
    <SupportedAdtMessages>
        <adtMessage>
        </adtMessage>
        <adtMessage>
        </adtMessage>
    </SupportedAdtMessages>
    <Fileds>
        <Field>
            <name>
            </name>
            <Location>
                <hl7Segment/>
            </Location>
            <Location>
                <hl7Segment/>
            </Location>
            <description>
            </description>
            <Validations>
                <usage/>
            </Validations>
        </Field>
        <Field>
            <name>
            </name>
            <Location>
                <hl7Segment/>
            </Location>
            <Location>
                <hl7Segment/>
            </Location>
            <description>
            </description>
            <Validations>
                <usage/>
            </Validations>
        </Field>
    </Fileds>
    <ErrorMessages>
        <errorMessage/>
        <errorMessage/>
    </ErrorMessages>
</HL7Validation>
